<?xml version="1.0" encoding="UTF-8"?>
<xs:schema xmlns:xs="http://www.w3.org/2001/XMLSchema" elementFormDefault="qualified">
  <xs:element name="content">
    <xs:complexType>
      <xs:sequence>
        <xs:element ref="description"/>
      </xs:sequence>
    </xs:complexType>
  </xs:element>
  <xs:element name="description">
    <xs:complexType>
      <xs:sequence>
        <xs:element ref="levelledPara"/>
      </xs:sequence>
    </xs:complexType>
  </xs:element>
  <xs:element name="levelledPara">
    <xs:complexType>
      <xs:sequence>
        <xs:choice minOccurs="0" maxOccurs="unbounded">
          <xs:element ref="levelledPara"/>
          <xs:element ref="caption"/>
          <xs:element ref="figure"/>
          <xs:element ref="title"/>
        </xs:choice>
        <xs:choice>
          <xs:element ref="table"/>
          <xs:element minOccurs="0" maxOccurs="unbounded" ref="para"/>
        </xs:choice>
      </xs:sequence>
      <xs:attribute name="id" use="required" type="xs:NCName"/>
    </xs:complexType>
  </xs:element>
  <xs:element name="caption">
    <xs:complexType>
      <xs:sequence>
        <xs:element ref="captionLine"/>
      </xs:sequence>
    </xs:complexType>
  </xs:element>
  <xs:element name="captionLine" type="xs:string"/>
  <xs:element name="figure">
    <xs:complexType>
      <xs:sequence>
        <xs:element ref="graphic"/>
      </xs:sequence>
      <xs:attribute name="id" use="required" type="xs:NCName"/>
    </xs:complexType>
  </xs:element>
  <xs:element name="graphic">
    <xs:complexType>
      <xs:attribute name="id" use="required" type="xs:NCName"/>
      <xs:attribute name="infoEntityIdent" use="required" type="xs:NCName"/>
    </xs:complexType>
  </xs:element>
  <xs:element name="title" type="xs:string"/>
  <xs:element name="table">
    <xs:complexType>
      <xs:sequence>
        <xs:element ref="tgroup"/>
      </xs:sequence>
      <xs:attribute name="frame" use="required" type="xs:NCName"/>
      <xs:attribute name="id" use="required" type="xs:NCName"/>
    </xs:complexType>
  </xs:element>
  <xs:element name="tgroup">
    <xs:complexType>
      <xs:sequence>
        <xs:element maxOccurs="unbounded" ref="colspec"/>
        <xs:element ref="tbody"/>
      </xs:sequence>
      <xs:attribute name="cols" use="required" type="xs:integer"/>
      <xs:attribute name="colsep" use="required" type="xs:integer"/>
    </xs:complexType>
  </xs:element>
  <xs:element name="colspec">
    <xs:complexType>
      <xs:attribute name="colname" use="required" type="xs:NCName"/>
      <xs:attribute name="colnum" use="required" type="xs:integer"/>
      <xs:attribute name="colwidth" use="required" type="xs:NMTOKEN"/>
    </xs:complexType>
  </xs:element>
  <xs:element name="tbody">
    <xs:complexType>
      <xs:sequence>
        <xs:element maxOccurs="unbounded" ref="row"/>
      </xs:sequence>
    </xs:complexType>
  </xs:element>
  <xs:element name="row">
    <xs:complexType>
      <xs:sequence>
        <xs:element maxOccurs="unbounded" ref="entry"/>
      </xs:sequence>
      <xs:attribute name="rowsep" use="required" type="xs:integer"/>
    </xs:complexType>
  </xs:element>
  <xs:element name="entry">
    <xs:complexType mixed="true">
      <xs:sequence>
        <xs:element minOccurs="0" maxOccurs="unbounded" ref="emphasis"/>
      </xs:sequence>
    </xs:complexType>
  </xs:element>
  <xs:element name="emphasis">
    <xs:complexType mixed="true">
      <xs:attribute name="emphasisType" use="required" type="xs:NCName"/>
    </xs:complexType>
  </xs:element>
  <xs:element name="para">
    <xs:complexType mixed="true">
      <xs:choice minOccurs="0" maxOccurs="unbounded">
        <xs:element ref="emphasis"/>
        <xs:element ref="randomList"/>
      </xs:choice>
    </xs:complexType>
  </xs:element>
  <xs:element name="randomList">
    <xs:complexType>
      <xs:sequence>
        <xs:element maxOccurs="unbounded" ref="listItem"/>
      </xs:sequence>
      <xs:attribute name="listItemPrefix" use="required" type="xs:NCName"/>
    </xs:complexType>
  </xs:element>
  <xs:element name="listItem">
    <xs:complexType>
      <xs:sequence>
        <xs:element ref="para"/>
      </xs:sequence>
    </xs:complexType>
  </xs:element>
</xs:schema>
